{
  "schema": "weles.benchmark.suite.v1",
  "name": "web-agent-fixture",
  "version": "1.0.0",
  "description": "Comparable browser-agent tasks against the deterministic Weles benchmark fixture.",
  "defaults": {
    "repetitions": 1,
    "concurrency": 1,
    "timeoutMs": 300000,
    "pollIntervalMs": 2000
  },
  "thresholds": {
    "successRateMin": 0.8,
    "p95DurationMsMax": 300000
  },
  "cases": [
    {
      "id": "static-extraction",
      "title": "Extract deterministic static content",
      "instruction": "Open the page. Return its main heading as heading, every list item as items, and the main element's data-checksum attribute as checksum.",
      "origin": "${FIXTURE_ORIGIN}",
      "action": "benchmark_static_extract",
      "input": { "url": "${FIXTURE_ORIGIN}/static" },
      "justification": "Measure extraction on the operator-controlled Weles benchmark fixture.",
      "credentialRefs": [],
      "evidencePolicy": "none",
      "tags": ["read", "static"],
      "expected": {
        "acceptedStatuses": ["succeeded"],
        "receiptRequired": false,
        "assertions": [
          { "path": "/heading", "operator": "equals", "value": "Static content" },
          { "path": "/items", "operator": "includes", "value": "gamma" },
          { "path": "/checksum", "operator": "equals", "value": "alpha-beta-gamma" }
        ]
      }
    },
    {
      "id": "navigation",
      "title": "Follow a link to a canonical record",
      "instruction": "Open the page, follow the canonical record link, then return the destination record identifier as recordId and its output value as value.",
      "origin": "${FIXTURE_ORIGIN}",
      "action": "benchmark_navigation",
      "input": { "url": "${FIXTURE_ORIGIN}/navigation", "recordId": "record-42" },
      "justification": "Measure navigation on the operator-controlled Weles benchmark fixture.",
      "credentialRefs": [],
      "evidencePolicy": "none",
      "tags": ["read", "navigation"],
      "expected": {
        "acceptedStatuses": ["succeeded"],
        "receiptRequired": false,
        "assertions": [
          { "path": "/recordId", "operator": "equals", "value": "record-42" },
          { "path": "/value", "operator": "equals", "value": "deterministic-detail" }
        ]
      }
    },
    {
      "id": "form-submit",
      "title": "Submit a deterministic local form",
      "instruction": "Open the page, enter the requested input value in the benchmark field, submit the form, then return submitted as a boolean and the displayed submitted value as value.",
      "origin": "${FIXTURE_ORIGIN}",
      "action": "benchmark_form_submit",
      "input": { "url": "${FIXTURE_ORIGIN}/form", "value": "weles-benchmark" },
      "justification": "Measure a reversible form interaction on the operator-controlled Weles benchmark fixture.",
      "credentialRefs": [],
      "evidencePolicy": "none",
      "tags": ["write", "form"],
      "expected": {
        "acceptedStatuses": ["succeeded"],
        "receiptRequired": false,
        "assertions": [
          { "path": "/submitted", "operator": "equals", "value": true },
          { "path": "/value", "operator": "equals", "value": "weles-benchmark" }
        ]
      }
    },
    {
      "id": "dynamic-render",
      "title": "Wait for delayed client-side rendering",
      "instruction": "Open the page, wait until the dynamic output stops saying pending, then return its final text as message.",
      "origin": "${FIXTURE_ORIGIN}",
      "action": "benchmark_dynamic_render",
      "input": { "url": "${FIXTURE_ORIGIN}/dynamic" },
      "justification": "Measure dynamic rendering on the operator-controlled Weles benchmark fixture.",
      "credentialRefs": [],
      "evidencePolicy": "none",
      "tags": ["read", "dynamic"],
      "expected": {
        "acceptedStatuses": ["succeeded"],
        "receiptRequired": false,
        "assertions": [
          { "path": "/message", "operator": "equals", "value": "rendered-after-delay" }
        ]
      }
    },
    {
      "id": "table-scan",
      "title": "Scan a deterministic 100-row table",
      "instruction": "Open the page. Count all body rows as rowCount and sum their numeric index cells as indexChecksum. Return both numbers.",
      "origin": "${FIXTURE_ORIGIN}",
      "action": "benchmark_table_scan",
      "input": { "url": "${FIXTURE_ORIGIN}/table" },
      "justification": "Measure structured extraction on the operator-controlled Weles benchmark fixture.",
      "credentialRefs": [],
      "evidencePolicy": "none",
      "tags": ["read", "table"],
      "expected": {
        "acceptedStatuses": ["succeeded"],
        "receiptRequired": false,
        "assertions": [
          { "path": "/rowCount", "operator": "equals", "value": 100 },
          { "path": "/indexChecksum", "operator": "equals", "value": 5050 }
        ]
      }
    }
  ]
}
